ID,Title,Author,Length,URL,Year,Approach
video001,Tips and Tricks- Full Narrated Robotic-Assisted Prostatectomy,AdventHealth Global Robotics Institute,5071.633,http://dg1fmc8qbela5.cloudfront.net/video001.mp4,2016,anterior
video002,2008 AUA Fagin Prostatectomy,VIP Urology,3604.851519,http://dg1fmc8qbela5.cloudfront.net/video002.mp4,2008,posterior
video003,Aldo Bocciardi - Robotic Retzius Sparing Radical Prostatectomy,Fondazione Vincenzo Pansadoro,4012.965442,http://dg1fmc8qbela5.cloudfront.net/video003.mp4,2019,posterior
video005,CILR 2012 - Richard Gaston - Nerve-sparing robotic-assisted laparoscopic radical prostatectomy,Fondazione Vincenzo Pansadoro,6922.797279,http://dg1fmc8qbela5.cloudfront.net/video005.mp4,2012,anterior
video006,CILR 2012 - Vipul Patel - Nerve-sparing robotic-assisted laparoscopic radical prostatectomy,Fondazione Vincenzo Pansadoro,4224.569,http://dg1fmc8qbela5.cloudfront.net/video006.mp4,2012,anterior
video007,CILR 2015 - Vipul Patel - Robotic radical prostatectomy,Fondazione Vincenzo Pansadoro,2745.783,http://dg1fmc8qbela5.cloudfront.net/video007.mp4,2015,anterior
video008,Clipless Robotic Assistec Radical Prostatectomy,Victor Dubeux,2003.232,http://dg1fmc8qbela5.cloudfront.net/video008.mp4,2020,anterior
video009,Complete case of Retzius-sparing RARP (August 2019),Santis,1846.822313,http://dg1fmc8qbela5.cloudfront.net/video009.mp4,2019,posterior
video010,Copy of Robotic prostatectomy Full Case Step by Step with Expert Surgeon,Naveen Kella,4019.25805,http://dg1fmc8qbela5.cloudfront.net/video010.mp4,2014,posterior
video011,Declan Murphy Live Robotic Prostatectomy #WRSE24 May 2016,Declan Murphy,6089.200907,http://dg1fmc8qbela5.cloudfront.net/video011.mp4,2014,anterior
video012,"Dr Boon Kua Da Vinci Robotic Prostatectomy, Brisbane, Australia",Boon Kua,2021.552472,http://dg1fmc8qbela5.cloudfront.net/video012.mp4,2014,anterior
video013,Dr. Ahmed and Dr. Lovallo performing a salvage prostatectomy following prostate brachytherapy,New Jersey Center Prostate Cancer & Urology,3417.838005,http://dg1fmc8qbela5.cloudfront.net/video013.mp4,2013,anterior
video014,Dr. Jim Hu - Robotic Extraperitoneal Radical Prostatectomy Surgical Video With Narration,Weill Cornell Urology,2148.217324,http://dg1fmc8qbela5.cloudfront.net/video014.mp4,2019,anterior
video015,Dr. Jim Hu - Transperitoneal Robotic-Assisted Radical Prostatectomy,Weill Cornell Urology,6104.665397,http://dg1fmc8qbela5.cloudfront.net/video015.mp4,2017,anterior
video016,Dr. Lovallo Performing a robotic simple prostatectomy,New Jersey Center Prostate Cancer & Urology,3000.018141,http://dg1fmc8qbela5.cloudfront.net/video016.mp4,2013,anterior
video017,Dr. Lutfi Tunc Blader Neck Preservation Aproach Nerve Sparing RALP da Vinci SI System,Prof. Dr. Lütfi Tunç,4747.737687,http://dg1fmc8qbela5.cloudfront.net/video017.mp4,2016,posterior
video018,Dr. Lutfi Tunc Blader Neck Preservation Aproach Non-Nerve Sparing RALP da Vinci XI System,Prof. Dr. Lütfi Tunç,4819.301587,http://dg1fmc8qbela5.cloudfront.net/video018.mp4,2016,posterior
video019,Dr. Patel- Robotic-assisted Radical Prostatectomy- Nerve Sparing technique.,Robotic Surgery Academy,1526.712018,http://dg1fmc8qbela5.cloudfront.net/video019.mp4,2019,anterior
video020,Dr. Rafael Coelho-Prostatectomia Radical Robotica - Ircad América latina,Dr. Rafael Coelho - Urologia,2655.736,http://dg1fmc8qbela5.cloudfront.net/video020.mp4,2018,anterior
video021,ExPeritoneal Radical Prostatectomy Laparoscopic with Audio Commentary,Dr Aditya K Sharma,1333.754195,http://dg1fmc8qbela5.cloudfront.net/video021.mp4,2019,anterior
video023,Full Length Robotic Prostatectomy,Dr Rad,2047.025,http://dg1fmc8qbela5.cloudfront.net/video023.mp4,2019,posterior
video024,Full Length Robotic Radical Prostatectomy - Lateral Approach - Dr. Richard Gaston,Dr. Fernando Gómez Sancha,2446.640181,http://dg1fmc8qbela5.cloudfront.net/video024.mp4,2017,posterior
video025,Full Robotic prostate cancer removal with Expert Surgeon Naveen Kella,Naveen Kella,4719.781,http://dg1fmc8qbela5.cloudfront.net/video025.mp4,2015,posterior
video026,"Full-length, unedited, narrated Robotic Prostatectomy performed live by Dr. Ronney Abaza in 2018",Robotic Urologic Surgery with Dr. Ronney Abaza,5490.103,http://dg1fmc8qbela5.cloudfront.net/video026.mp4,2018,anterior
video027,Ignacio Moncada - Robitic Simple Prostatectomy,Fondazione Vincenzo Pansadoro,2648.700227,http://dg1fmc8qbela5.cloudfront.net/video027.mp4,2019,anterior
video028,ircad 2021 - Live Surgery - Robotic Prostatectomy - Dr Rafael Coelho,Dr. Rafael Coelho - Urologia,2006.46,http://dg1fmc8qbela5.cloudfront.net/video028.mp4,2021,anterior
video029,ircad rio - Dr Rafael Coelho - Prostatectomia Robotica/Robotic Prostatectomy,Dr. Rafael Coelho - Urologia,2440.812,http://dg1fmc8qbela5.cloudfront.net/video029.mp4,2018,anterior
video030,Jens Uwe Stolzenburg - Robotic radical Prostatectomy,Fondazione Vincenzo Pansadoro,4672.296054,http://dg1fmc8qbela5.cloudfront.net/video030.mp4,2019,anterior
video031,laparoscopic extraperitoneal radical prostatectomy in a patient with previous hormone treatment,ΝΙΚΟΛΑΟΣ ΦΕΡΑΚΗΣ,3333.13161,http://dg1fmc8qbela5.cloudfront.net/video031.mp4,2015,anterior
video032,Laparoscopic Prostatectomy,laparoscoendourology,2449.960635,http://dg1fmc8qbela5.cloudfront.net/video032.mp4,2021,anterior
video033,LAPAROSCOPIC PROSTATECTOMY GOUMAS,Ioannis Kartalas Goumas,3916.99737,http://dg1fmc8qbela5.cloudfront.net/video033.mp4,2020,anterior
video034,Laparoscopic Radical Prostatectomy,"dr. Ahmad Zulfan Hendri, Sp.U (K)",2271.817143,http://dg1fmc8qbela5.cloudfront.net/video034.mp4,2019,anterior
video035,Laparoscopic Radical Prostatectomy - Ca.prostate in presence of chronic prostatitis| Surgical Videos,Asian Institute of Nephrology & Urology,3252.698,http://dg1fmc8qbela5.cloudfront.net/video035.mp4,2021,posterior
video036,"Laparoscopic Radical Prostatectomy - Extraperitoneal approach, nerve sparing",Endourology Patras,1517.981315,http://dg1fmc8qbela5.cloudfront.net/video036.mp4,2012,anterior
video037,"Laparoscopic radical prostatectomy - full, 1x speed",Uro surgery,4797.173,http://dg1fmc8qbela5.cloudfront.net/video037.mp4,2021,anterior
video038,Laparoscopic radical prostatectomy of a 150 ml prostate with a median lobe,Ioannis Kartalas Goumas,5553.214694,http://dg1fmc8qbela5.cloudfront.net/video038.mp4,2020,anterior
video039,Laparoscopic Radical Prostatectomy Surgery,Dr. Jaydeep Date,1509.227392,http://dg1fmc8qbela5.cloudfront.net/video039.mp4,2019,anterior
video042,LAPAROSCOPIC RADICAL PROSTATECTOMY WITH BILATERAL PELVIC LYMPHADENECTOMY,Preeti Hospital-Best Urology Hospital in Hyderabad,17268.63379,http://dg1fmc8qbela5.cloudfront.net/video042.mp4,2020,posterior
video043,Laparoscopic Radical Prostatectomy with Nerve Sparing,Dr Aditya K Sharma,2568.777143,http://dg1fmc8qbela5.cloudfront.net/video043.mp4,2019,anterior
video044,Live daVinci Robotic Prostate Removal 2 - Capitol Urology,Thomas Edmunds,4564.323265,http://dg1fmc8qbela5.cloudfront.net/video044.mp4,2012,posterior
video045,Live daVinci Robotic Prostatectomy Capitol Urology Columbia SC,Thomas Edmunds,1355.209433,http://dg1fmc8qbela5.cloudfront.net/video045.mp4,2012,anterior
video046,"Live OR: Robot-Assisted Laparoscopic Prostatectomy with Dr. Richstone, Dr. Mikhail and Dr. Rai",BRAINterns Webinar Series,3573.80644,http://dg1fmc8qbela5.cloudfront.net/video046.mp4,2020,anterior
video047,Live robotic da Vinci radical prostatectomy during EAU congress - Barcelona,urologiemondor,2851.71229,http://dg1fmc8qbela5.cloudfront.net/video047.mp4,2010,anterior
video048,Live Robotic Prostatectomy WRSE Nov 16 DECLAN MURPHY,Declan Murphy,6037.769,http://dg1fmc8qbela5.cloudfront.net/video048.mp4,2016,anterior
video049,Live Robotic Prostatectomy | WRSE Jan 19,Declan Murphy,4109.653333,http://dg1fmc8qbela5.cloudfront.net/video049.mp4,2019,anterior
video050,LIVE SURGERY: Prostatectomy w/ Extended Pelvic Lymph Node Dissection,Seattle Science Foundation,9351.372335,http://dg1fmc8qbela5.cloudfront.net/video050.mp4,2015,anterior
video051,Manuel Rubial - Laparoscopic Nerve Sparing Radical Prostatectomy,Fondazione Vincenzo Pansadoro,7164.099048,http://dg1fmc8qbela5.cloudfront.net/video051.mp4,2019,anterior
video052,Markus Graefen - Robotic Radical Prostatectomy + LDN for T3 cancer,Fondazione Vincenzo Pansadoro,6576.82,http://dg1fmc8qbela5.cloudfront.net/video052.mp4,2019,anterior
video053,Maximum periprostatic anatomy preserving-robotic prostatectomy (MPAP-RALP): Surgical technique,"Yifan Chang, M.D.",5278.49941,http://dg1fmc8qbela5.cloudfront.net/video053.mp4,2018,anterior
video054,Miguel Ramirez Backhaus - Laparoscopic Prostatectomy with ICG,Fondazione Vincenzo Pansadoro,9007.182948,http://dg1fmc8qbela5.cloudfront.net/video054.mp4,2019,anterior
video055,"Narrated, Full length Robotic Prostatectomy by Dr Abaza w Airseal Ultralow Pneumo of 6mmHg and ROSI",Robotic Urologic Surgery with Dr. Ronney Abaza,6103.620499,http://dg1fmc8qbela5.cloudfront.net/video055.mp4,2021,posterior
video056,Nerve Sparing Robot Assisted Radical Prostatectomy - Full Case,IMSRU,2909.042358,http://dg1fmc8qbela5.cloudfront.net/video056.mp4,2020,anterior
video057,NEW Full-length unedited SP Robotic Prostatectomy with PLND by Dr. Ronney Abaza,Robotic Urologic Surgery with Dr. Ronney Abaza,7989.034376,http://dg1fmc8qbela5.cloudfront.net/video057.mp4,2021,posterior
video058,New Robotic-Assisted Prostatectomy Technique- February 2016,AdventHealth Global Robotics Institute,4322.604,http://dg1fmc8qbela5.cloudfront.net/video058.mp4,2016,anterior
video059,Non Nerve Sparing Robotic Prostatectomy (Posterior Approach) by Dr. K. Ramesh,Chennai Urology - Dr. K. Ramesh | Urologist | Robotic Surgeon,1597.138141,http://dg1fmc8qbela5.cloudfront.net/video059.mp4,2015,posterior
video062,Pelvic lymph node dissection during Robotic radical prostatectomy | Full step | Dr Lucas Burttet,Dr. Lucas Burttet - Urologia / Cirurgia Robótica,2764.382041,http://dg1fmc8qbela5.cloudfront.net/video062.mp4,2021,anterior
video063,Prostatectomia Radical Robotica ao vivo - Curso Internacional Cirurgia Robotica - Dr Rafael Coelho,Dr. Rafael Coelho - Urologia,3471.569,http://dg1fmc8qbela5.cloudfront.net/video063.mp4,2020,anterior
video064,Prostatectomie Totale Robot LIVE Nicolas DOUMERC,Nicolas DOUMERC,8250.769705,http://dg1fmc8qbela5.cloudfront.net/video064.mp4,2016,anterior
video065,Retzius Sparing Robot Assisted Radical Prostatectomy (Posterior Approach) by Dr. Tae Young Shin,the shinergizer,7017.674014,http://dg1fmc8qbela5.cloudfront.net/video065.mp4,2017,posterior
video066,Robot Assisted Radical Prostatectomy,"Joseph Pettus, M.D.",2315.099138,http://dg1fmc8qbela5.cloudfront.net/video066.mp4,2015,anterior
video067,Robot Assisted Radical Prostatectomy - Nerve Sparing,Robotic Surgery Academy,2960.846077,http://dg1fmc8qbela5.cloudfront.net/video067.mp4,2020,anterior
video068,Robot Assisted Radical Prostatectomy RARP,Medline Health,10623.269,http://dg1fmc8qbela5.cloudfront.net/video068.mp4,2019,anterior
video069,Robot-assisted radical prostatectomy,Teck Wei Tan,5578.849524,http://dg1fmc8qbela5.cloudfront.net/video069.mp4,2020,posterior
video071,Robotic Assisted Laparoscopic Radical Prostatectomy | Brigham and Women's Hospital,Brigham And Women's Hospital,1567.486259,http://dg1fmc8qbela5.cloudfront.net/video071.mp4,2018,anterior
video072,Robotic Assisted Prostatectomy (RALP)_20 min.mp4,BangSurgical,1200.634195,http://dg1fmc8qbela5.cloudfront.net/video072.mp4,2012,posterior
video073,Robotic Assisted Radical Prostatectomy,Henry Woo,4363.494,http://dg1fmc8qbela5.cloudfront.net/video073.mp4,2020,anterior
video074,Robotic Assisted Radical Prostatectomy - Dr Gustavo Cardoso Guimarães,Instituto de Urologia Oncologia e Cirurgia Robótica,1487.075556,http://dg1fmc8qbela5.cloudfront.net/video074.mp4,2015,anterior
video075,Robotic assisted Radical Prostatectomy by Prof. Dr. Mottrie (Full video),ORSI,1697.332245,http://dg1fmc8qbela5.cloudfront.net/video075.mp4,2014,anterior
video076,Robotic Assisted Radical Prostatectomy Non Nerve Sparing,Henry Woo,3438.248345,http://dg1fmc8qbela5.cloudfront.net/video076.mp4,2020,anterior
video077,"ROBOTIC ASSISTED RADICAL PROSTATECTOMY, FULL CASE NO EDITION.",FRANCISCO CARVALHO,4404.384218,http://dg1fmc8qbela5.cloudfront.net/video077.mp4,2021,anterior
video079,Robotic Prostatectomy (RALP)_22 min.mp4,BangSurgical,1311.184399,http://dg1fmc8qbela5.cloudfront.net/video079.mp4,2012,anterior
video081,Robotic Prostatectomy 2006 Fagin,VIP Urology,4109.676553,http://dg1fmc8qbela5.cloudfront.net/video081.mp4,2006,posterior
video082,Robotic Prostatectomy 2012,VIP Urology,3729.589116,http://dg1fmc8qbela5.cloudfront.net/video082.mp4,2012,anterior
video083,Robotic prostatectomy after abandoned open radical prostatectomy | June 2019,Declan Murphy,8198.385488,http://dg1fmc8qbela5.cloudfront.net/video083.mp4,2019,anterior
video084,"robotic prostatectomy by Dr Geoff Coughlin 2017 unedited, narrated",Geoff Coughlin,3573.505,http://dg1fmc8qbela5.cloudfront.net/video084.mp4,2017,anterior
video085,"Robotic prostatectomy by Edward Schaeffer, MD, PhD",NM Urology,2347.653514,http://dg1fmc8qbela5.cloudfront.net/video085.mp4,2017,posterior
video086,Robotic prostatectomy Full Case Step by Step with Expert Surgeon,Naveen Kella,4018.701,http://dg1fmc8qbela5.cloudfront.net/video086.mp4,2014,posterior
video087,Robotic Prostatectomy Full Length 2010,VIP Urology,3132.720181,http://dg1fmc8qbela5.cloudfront.net/video087.mp4,2010,posterior
video088,Robotic Prostatectomy full length by Dr Geoff Coughlin,Geoff Coughlin,4555.894422,http://dg1fmc8qbela5.cloudfront.net/video088.mp4,2013,anterior
video089,Robotic prostatectomy in Hong Kong live case,Hany Atalah,2521.524535,http://dg1fmc8qbela5.cloudfront.net/video089.mp4,2008,posterior
video091,Robotic prostatectomy with early NVB release & anterior Retzius-sparing for anterior prostate ca.,Christopher Eden,2189.200544,http://dg1fmc8qbela5.cloudfront.net/video091.mp4,2020,posterior
video092,Robotic Prostatectomy with the da Vinci X robotic surgery system,Conray Moolman,3130.909025,http://dg1fmc8qbela5.cloudfront.net/video092.mp4,2019,anterior
video093,Robotic Prostatectomy- WRSE 2020 - Dr Rafael Coelho Urologista,Dr. Rafael Coelho - Urologia,1596.395102,http://dg1fmc8qbela5.cloudfront.net/video093.mp4,2020,anterior
video094,"Robotic prostatectomy: Managing an ectopic ureteral orifice, dissection by Edward Schaeffer, MD, PhD",NM Urology,1971.37415,http://dg1fmc8qbela5.cloudfront.net/video094.mp4,2020,anterior
video095,Robotic Radical Prostatectomy,Asian Institute of Nephrology & Urology,5616.81415,http://dg1fmc8qbela5.cloudfront.net/video095.mp4,2020,posterior
video096,"Robotic Radical Prostatectomy (Nerve sparing, Bladder neck preserving)",Asian Institute of Nephrology & Urology,3645.57932,http://dg1fmc8qbela5.cloudfront.net/video096.mp4,2020,posterior
video097,ROBOTIC RADICAL PROSTATECTOMY - RARP- FULL SURGICAL CASE- PATIENT EDUCATION- Dr. KEVIN ZORN,DrKevinZorn,4589.912,http://dg1fmc8qbela5.cloudfront.net/video097.mp4,2013,posterior
video098,Robotic radical prostatectomy for large prostate with median lobe,Prof. Dr. Lütfi Tunç,5257.044172,http://dg1fmc8qbela5.cloudfront.net/video098.mp4,2017,posterior
video099,Robotic Radical Prostatectomy in 24 January 2018 Full Length,Prof. Dr. Lütfi Tunç,5645.653,http://dg1fmc8qbela5.cloudfront.net/video099.mp4,2018,posterior
video100,Robotic Radical Prostatectomy in 28 December 2017,Prof. Dr. Lütfi Tunç,4409.493,http://dg1fmc8qbela5.cloudfront.net/video100.mp4,2017,posterior
video101,Robotic Radical Prostatectomy Live Surgery Course in 16-17 December 2017,Prof. Dr. Lütfi Tunç,4520.67,http://dg1fmc8qbela5.cloudfront.net/video101.mp4,2017,posterior
video102,Robotic Radical Prostatectomy to 300 cc Prostate in 5th of April 2019,Prof. Dr. Lütfi Tunç,7627.941,http://dg1fmc8qbela5.cloudfront.net/video102.mp4,2019,posterior
video103,Robotic Radical Prostatectomy with Bladder Neck Sparing Surgery Technique in 23-26 February 2018,Prof. Dr. Lütfi Tunç,4256.867846,http://dg1fmc8qbela5.cloudfront.net/video103.mp4,2018,posterior
video104,Robotic Radical Prostatectomy with Bladder Neck Sparing Technique in 14 February 2018,Prof. Dr. Lütfi Tunç,4102.246168,http://dg1fmc8qbela5.cloudfront.net/video104.mp4,2018,anterior
video105,Robotic Radical Prostatectomy with Bladder Neck Sparing Technique in 20 April 2018,Prof. Dr. Lütfi Tunç,3605.177,http://dg1fmc8qbela5.cloudfront.net/video105.mp4,2018,posterior
video106,Robotic Radical Prostatectomy with Bladder Neck Sparing Technique in16 February 2019,Prof. Dr. Lütfi Tunç,4411.838,http://dg1fmc8qbela5.cloudfront.net/video106.mp4,2019,posterior
video107,"Robotic radical prostatectomy, Nerve preservation by lateral approach, full length.",UROLOGIE SAINT AUGUSTIN,2646.1,http://dg1fmc8qbela5.cloudfront.net/video107.mp4,2017,anterior
video108,"Robotic Retzius-sparing radical prostatectomy, full unedited surgery by Rabii Madi, MD",rabih33,1708.339,http://dg1fmc8qbela5.cloudfront.net/video108.mp4,2017,posterior
video109,Robotic Transvesical Suprapubic Prostatectomy,Nick Donin,1455.589297,http://dg1fmc8qbela5.cloudfront.net/video109.mp4,2020,anterior
video110,Robotic-assisted laparoscopic radical prostatectomy (console time 27 min uncut version),"Yifan Chang, M.D.",1632.757551,http://dg1fmc8qbela5.cloudfront.net/video110.mp4,2018,anterior
video111,"SA-48 Laparoscopic radical prostatectomy - nerve sparing - no editing - Serdar Aykan, MD Assoc Prof",SERDAR AYKAN,3094.198277,http://dg1fmc8qbela5.cloudfront.net/video111.mp4,2020,anterior
video112,Salvage radical prostatectomy,TNM Urology,7918.492,http://dg1fmc8qbela5.cloudfront.net/video112.mp4,2021,anterior
video113,Salvage Robotic-Assisted Prostatectomy- March 2016,AdventHealth Global Robotics Institute,4382.348481,http://dg1fmc8qbela5.cloudfront.net/video113.mp4,2016,anterior
video114,simple prostatectomy rasp robotic,Bernardo Rocco,2215.903492,http://dg1fmc8qbela5.cloudfront.net/video114.mp4,2020,anterior
video115,Ultra-wide excision of neurovascular bundles in robotic prostatectomy for T3bN0M0 prostate cancer.,Santis,1986.56,http://dg1fmc8qbela5.cloudfront.net/video115.mp4,2020,posterior
video116,Unedited robotic-assisted laparoscopic radical prostatectomy with extended pelvic lymphadenectomy,UrologyRobotics,13011.32481,http://dg1fmc8qbela5.cloudfront.net/video116.mp4,2014,posterior
video117,Urethrovesical anastomosis during laparoscopic radical prostatectomy,Uro surgery,1406.641,http://dg1fmc8qbela5.cloudfront.net/video117.mp4,2021,anterior
video118,Urology Teaching Collaborative | 5/28/20 | Dr. John Davis: Robotic Prostatectomy,Urology Teaching Collaborative - Albany Med.,3845.34059,http://dg1fmc8qbela5.cloudfront.net/video118.mp4,2020,anterior
video119,urologybook.com moinzadeh robotic assisted laparoscopic radical prostatectomy with nerve sparing,urologybook,2358.938413,http://dg1fmc8qbela5.cloudfront.net/video119.mp4,2012,anterior
video120,Vipul Patel - Robotic Nerve Sparing Prostatectomy,Fondazione Vincenzo Pansadoro,4285.730249,http://dg1fmc8qbela5.cloudfront.net/video120.mp4,2019,anterior
video121,Weill Cornell Urology: Dr. Jim C. Hu - Radical Prostatectomy,Weill Cornell Urology,2321.043447,http://dg1fmc8qbela5.cloudfront.net/video121.mp4,2021,posterior
video122,Laparoscopic Radical Prostatectomy (Semi Live) | Surgical Videos,Asian Institute of Nephrology & Urology,2373.822,http://dg1fmc8qbela5.cloudfront.net/video122.mp4,2021,posterior
video123,da Vinci Robotic Prostatectomy 3D Video - Dr. Eric Diner,Eric K. Diner MD,5212.32254,http://dg1fmc8qbela5.cloudfront.net/video123.mp4,2012,posterior
video124,Robotic Radical Prostatectomy with Lymph Node Dissection,Eric K. Diner MD,11324.76662,http://dg1fmc8qbela5.cloudfront.net/video124.mp4,2015,anterior
video125,Lap simple prostatectomy transvesical approach/лапароскопическая аденомэктомия/Живая хирургия/Кочкин,Dr Alexey D. Kochkin,5426.898141,http://dg1fmc8qbela5.cloudfront.net/video125.mp4,2021,posterior
video126,Robotic inguinal hernia repair during Radical Prostatectomy,Robotic Surgery,2241.887,http://dg1fmc8qbela5.cloudfront.net/video126.mp4,2021,anterior
video127,CILR 2008 - Richard Gaston - Robotic assisted radical prostatectomy,Fondazione Vincenzo Pansadoro,7045.677,http://dg1fmc8qbela5.cloudfront.net/video127.mp4,2008,anterior
video128,Minimally Invasive Prostatectomy To Treat Prostate Cancer - Dr. Eric Diner,Eric K. Diner MD,5869.261497,http://dg1fmc8qbela5.cloudfront.net/video128.mp4,2012,anterior
video131,lap radical prostatectomy part 1,lap radical prostatectomy part 1,3170.267,http://dg1fmc8qbela5.cloudfront.net/video131.mp4,2017,anterior
video132,Robotic Simple Prostatectomy,Robotic Simple Prostatectomy,1405.689615,http://dg1fmc8qbela5.cloudfront.net/video132.mp4,2016,anterior
video133,Robotic Prostatectomy Performed By Dr. Jason Engel,"Jason D. Engel, M.D.",2096.042078,http://dg1fmc8qbela5.cloudfront.net/video133.mp4,2016,anterior
video134,Robot-assisted radical prostatectomy - Koon Ho Rha,Fondazione Vincenzo Pansadoro,3982.640181,http://dg1fmc8qbela5.cloudfront.net/video134.mp4,2017,posterior
video135,CILR 2016 - Kris Maes - Robotic radical prostatectomy,Fondazione Vincenzo Pansadoro,6779.808798,http://dg1fmc8qbela5.cloudfront.net/video135.mp4,2016,anterior
video136,Robot assisted extrafascial radical prostatectomy - Vito Pansadoro,Fondazione Vincenzo Pansadoro,8332.481,http://dg1fmc8qbela5.cloudfront.net/video136.mp4,2017,anterior
video137,Lap unilateral nerve-sparing prostatectomy live/Живая хирургия/лап простатэктомия/нервсбережение/инь,Dr Alexey D. Kochkin,6084.301497,http://dg1fmc8qbela5.cloudfront.net/video137.mp4,2020,anterior
video138,Live simple prostatectomy/Retzius-sparing/Живая хирургия/Лапароскопическая аденомэктомия,Dr Alexey D. Kochkin,6072.088,http://dg1fmc8qbela5.cloudfront.net/video138.mp4,2020,anterior
video139,Dr Vipul Patel - da Vinci SP radical prostatectomy,Robotic Surgery Academy,3716.47,http://dg1fmc8qbela5.cloudfront.net/video139.mp4,2019,anterior
video140,Volkan Tugcu - Robotic Transperineal Radical Prostatectomy,Fondazione Vincenzo Pansadoro,2292.575782,http://dg1fmc8qbela5.cloudfront.net/video140.mp4,2019,anterior
video141,CILR 2016 - Franco Gaboardi & Bernardo Rocco - Robotic extrafascial prostatectomy,Fondazione Vincenzo Pansadoro,8767.716,http://dg1fmc8qbela5.cloudfront.net/video141.mp4,2016,anterior
video143,First surgery,Robotic prostate cancer surgery by Professor Ren,3622.499,http://dg1fmc8qbela5.cloudfront.net/video143.mp4,2021,anterior
video144,Robotic Prostatectomy 2013,VIP Urology,3625.12254,http://dg1fmc8qbela5.cloudfront.net/video144.mp4,2013,posterior
video145,First surgery,Robotic prostate cancer surgery by Professor Ren,3631.694,http://dg1fmc8qbela5.cloudfront.net/video145.mp4,2021,anterior
video146,Second surgery,Robotic prostate cancer surgery by Professor Ren,3688.862,http://dg1fmc8qbela5.cloudfront.net/video146.mp4,2021,anterior
video147,Dr. Randy Fagin: Robotic Radical Prostatectomy IRUS Live,Vattikuti Foundation,3741.686712,http://dg1fmc8qbela5.cloudfront.net/video147.mp4,2011,posterior
video148,Robot-assisted radical prostatectomy with Retzius preservation - Aldo Bocciardi,Fondazione Vincenzo Pansadoro,3753.413,http://dg1fmc8qbela5.cloudfront.net/video148.mp4,2017,posterior
video150,Robot-assisted laparoscopic radical prostatectomy-RALP- B De Troyer,bart de troyer,3757.778141,http://dg1fmc8qbela5.cloudfront.net/video150.mp4,2017,anterior
video151,Second surgery,Robotic prostate cancer surgery by Professor Ren,3847.500045,http://dg1fmc8qbela5.cloudfront.net/video151.mp4,2021,anterior
video152,"Robotic Radical Prostatectomy -preservation of the anterior complex, and retrograde nerve dissection",Frederico Mascarenhas,3852.887075,http://dg1fmc8qbela5.cloudfront.net/video152.mp4,2021,anterior
video153,2010 AUA Fagin Prostatectomy,VIP Urology,3999.475,http://dg1fmc8qbela5.cloudfront.net/video153.mp4,2010,posterior
video154,Fourth Surgery,Robotic prostate cancer surgery by Professor Ren,4071.898,http://dg1fmc8qbela5.cloudfront.net/video154.mp4,2021,anterior
video155,Robotic Assisted Radical Prostatectomy Post Androgen Deprivation Therapy,Henry Woo,4144.181406,http://dg1fmc8qbela5.cloudfront.net/video155.mp4,2020,anterior
video156,Aldo Bocciardi - Robotic Retzius sparing radical prostatectomy,Fondazione Vincenzo Pansadoro,4185.884444,http://dg1fmc8qbela5.cloudfront.net/video156.mp4,2018,posterior
video157,CILR 2015 - Aldo Bocciardi - Robotic radical prostatectomy,Fondazione Vincenzo Pansadoro,4215.096,http://dg1fmc8qbela5.cloudfront.net/video157.mp4,2015,posterior
video158,CILR 2016 - Richard Gaston - Robotic intrafascial radical prostatectomy,Fondazione Vincenzo Pansadoro,4241.519456,http://dg1fmc8qbela5.cloudfront.net/video158.mp4,2016,anterior
video159,Laparoscopic prostatectomy and pelvic lymphadenectomy - E. Mandron,Fondazione Vincenzo Pansadoro,4256.473107,http://dg1fmc8qbela5.cloudfront.net/video159.mp4,2017,anterior
video160,Robotic-assisted radical prostatectomy,Uro Best Videos,4322.557098,http://dg1fmc8qbela5.cloudfront.net/video160.mp4,2020,anterior
video161,Sixth surgery,Robotic prostate cancer surgery by Professor Ren,4430.019048,http://dg1fmc8qbela5.cloudfront.net/video161.mp4,2021,anterior
video162,Prostatectomia Robótica,Colombo Urologia,4596.900862,http://dg1fmc8qbela5.cloudfront.net/video162.mp4,2020,anterior
video163,Robotic Prostatectomy To Treat Prostate Cancer,Eric K. Diner MD,4603.658,http://dg1fmc8qbela5.cloudfront.net/video163.mp4,2012,posterior
video164,CILR 2015 - Walter Artibani - Robotic radical prostatectomy,Fondazione Vincenzo Pansadoro,4610.81,http://dg1fmc8qbela5.cloudfront.net/video164.mp4,2015,anterior
